大丰,湖南省株洲市云龙大道与红旗中路交汇处附近,√, , 
None,广东省梅州市大埔县三河镇,√, , 
大旺,广东省肇庆市大旺高新区迎宾大道,√, , 
丹霞山,广东省韶关市仁化县周田镇平甫村,√, , 
低庄,湖南省怀化市溆浦县低庄镇,√, , 
鼎湖东,广东省肇庆市鼎湖区永安镇,√, , 
鼎湖山,广东省肇庆市鼎湖区桂城街道,√, , 
东方,海南省东方市解放东路,√, , 
东升,广东省中山市东升镇,√, , 
东莞,广东省东莞市石龙镇西湖区环湖西路,√, , 
东莞东,广东省东莞市常平镇常东路,√,√,√
洞井,湖南省长沙市雨花区中意一路与桃花塅路交汇口东北角,√, , 
端州,广东省肇庆市端州区肇庆大道与庆迎路交叉口,√, , 
None,广东省梅州市丰顺县汤坑镇,√, , 
凤凰机场,海南省三亚市凤凰镇机场路,√, , 
None,广东省佛山市禅城区文昌西路12号,√,√,√
佛山西,广东省佛山市南海区狮山镇,√, , 
芙蓉南,湖南省长沙市长沙生态动物园入口南侧,√, , 
福山镇,海南省澄迈县福山镇,√, , 
福田,广东省深圳市福华一路与益田路交汇处,√, , 
高州,广东省高州市站前路,√, , 
古镇,广东省中山市古镇镇同兴路,√, , 
光明城,广东省深圳市光明新区光明街道凤凰社区,√, , 
广宁,广东省肇庆市广宁县南街镇巷口村,√, , 
None,广东省广州市越秀区环市西路159号,√,√,√
广州北,广东省广州市花都区站前路1号,√, , 
广州东,广东省广州市天河区东站路1号,√,√,√
广州南,广东省广州市番禺区钟村镇石壁村,√, , 
海口,海南省海口市粤海大道,√,√,√
海口东,海南省海口市龙华区凤翔西路,√, , 
汉寿,湖南省常德市汉寿县太子庙镇,√, , 
None,广东省河源市和平县阳明镇龙湖村,√, , 
None,广东省河源市源城区建设大道西1号,√,√,√
荷塘,湖南省湘潭市岳塘区芙蓉大道与北二环交汇口以北,√, , 
None,湖南省衡阳市衡东县新塘镇文峰南路,√, , 
衡山西,湖南省衡阳市衡山县开云镇新坪村,√, , 
衡阳,湖南省衡阳市珠晖区车站坪1号,√,√,√
衡阳东,湖南省衡阳市珠晖区酃湖乡茅坪村,√, , 
鲘门,广东省汕尾市海丰县鲘门镇新乡村,√, , 
虎门,广东省东莞市虎门镇白沙社区站北路1号,√, , 
None,广东省梅州市五华县华城镇,√, , 
怀化,湖南省怀化市鹤州路1号,√, , 
怀化南,湖南省怀化市鹤城区盈口乡岩头村,√, , 
怀集,广东省肇庆市怀集县怀高村,√, , 
黄流,海南省乐东黎族自治县黄流镇孔汶村,√, , 
None,湖南省怀化市会同县林城镇将军北路,√, , 
惠东,广东省惠州市惠东县稔山镇石井村旁,√, , 
惠环,广东省惠州市陈江镇仲恺大道协和医院东侧,√, , 
None,广东省惠州市惠城区大道（小金口段）57号,√,√,√
惠州南,广东省惠州市惠阳区淡水镇大浦村爱民东路,√, , 
None,广东省惠州市惠城区永通路三号,√, , 
None,湖南省吉首市人民北路1号,√,√,√
尖峰,海南省乐东黎族自治县佛罗镇新丹村路口内,√, , 
江门东,广东省江门市江海区五邑路,√, , 
None,广东省揭阳市榕城区黄岐山大道北,√,√,√
金月湾,海南省东方市板桥镇,√, , 
None,湖南省怀化市靖州县境内渠阳镇红星路105号、106号,√, , 
九郎山,湖南省株洲市石峰区白马垅村,√, , 
葵潭,广东省揭阳市惠来县葵潭镇吉镇村,√, , 
老城镇,海南省澄迈县老城镇玉楼村,√, , 
乐昌,广东省乐昌市昌山中路22号,√, , 
乐昌东,广东省乐昌市长来镇和村,√, , 
乐东,海南省乐东县九所镇九所新区,√, , 
None,广东省湛江市雷州市白沙镇承乙环保砖厂旁,√, , 
None,湖南省耒阳市车站路1号,√, , 
耒阳西,湖南省耒阳市三顺办事处三顺村,√, , 
None,湖南省娄底市冷水江市金竹东路,√, , 
None,湖南省常德市澧县金罗镇,√, , 
醴陵东,湖南省醴陵市长庆示范区,√, , 
沥林北,广东省惠州市仲恺区沥林镇文化广场后,√, , 
None,湖南省涟源市城站路1号,√, , 
临高南,海南省临高县博厚镇,√, , 
临澧,湖南省常德市临澧县安福镇芭蕉社区,√, , 
None,湖南省岳阳市临湘市五里牌车站南街,√, , 
陵水,海南省陵水黎族自治县椰林北大道269号,√, , 
None,广东省河源市龙川县新城开发区,√,√,√
龙丰,广东省惠州市惠城区仲恺大道一城峯景附近,√, , 
None,湖南省娄底市氐星路,√,√,√
娄底南,湖南省娄底市万宝新区芭蕉镇,√, , 
陆丰,广东省汕尾市陆丰市城东镇高美村,√, , 
None,湖南省岳阳市云溪区路口镇,√, , 
None,湖南省怀化市麻阳县高村镇高垅社区1号,√, , 
茂名,广东省茂名市站北五路1号,√, , 
梅州,广东省梅州市彬芳大道南,√,√,√
美兰,海南省海口市美兰区海口美兰国际机场对面,√, , 
None,湖南省古丈县罗依溪镇,√, , 
None,湖南省汨罗市车站路,√, , 
汨罗东,湖南省汨罗市龙舟南路,√, , 
明珠,广东省珠海市香洲区明珠北路35号,√, , 
暮云,湖南省长沙市天心区暮云街道,√, , 
南江口,广东省云浮市郁南县南江口镇南瑶村,√, , 
南朗,广东省中山市南朗镇佳朗路通佳鞋厂旁,√, , 
南头,广东省中山市南头镇南头大道,√, , 
南雄,广东省韶关市南雄市雄州街道办事处,√, , 
宁乡,湖南省长沙市宁乡县车站路,√, , 
平湖,广东省深圳市龙岗区平湖街道上大街119号,√, , 
坪石,广东省乐昌市坪石镇岭南路25号,√, , 
普宁,广东省揭阳市普宁市流沙镇马栅乡,√, , 
祁东,湖南省衡阳市祁东县双桥镇林星村,√, , 
祁阳,湖南省永州市祁阳站浯溪镇长虹路,√, , 
棋子湾,海南省昌江县乌烈镇道隆村,√, , 
前山,广东省珠海市香洲区前山港昌路666号,√, , 
清远,广东省清远市清城区洲心镇洲沙村,√, , 
庆盛,广东省广州市南沙区东涌镇庆沙路88号,√, , 
琼海,海南省琼海市嘉积镇,√, , 
饶平,广东省潮州市饶平县高塘镇,√, , 
容桂,广东省佛山市容桂街道扁滘村,√, , 
None,广东省佛山市三水区西南街道站前街1号,√, , 
三水北,广东佛山市三水区西南街道南丰大道轻轨三水北站,√, , 
三水南,广东省佛山市三水区洲边镇,√, , 
三亚,海南市三亚市育秀路10号,√,√,√
汕头,广东省汕头市龙湖区泰山路,√,√,√
汕尾,广东省汕尾市城区东涌镇,√, , 
韶关,广东省韶关市浈江区西联镇滨江1路1号,√, , 
韶关东,广东省韶关东市浈江区南韶路56号,√, , 
韶山南,湖南省韶山市清溪镇韶南村,√, , 
None,湖南省邵阳市邵东县红岭路,√, , 
None,湖南省邵阳市大祥区魏源广场,√,√,√
邵阳北,湖南省邵阳市新邵县坪上镇,√, , 
None,广东省深圳市罗湖区建设路1003号,√,√,√
深圳北,广东省深圳市龙华新区致远中路28号,√, , 
深圳东,广东省深圳市龙岗区吉华路94号,√,√,√
深圳坪山,广东省深圳市坪山新区丹梓西路,√, , 
None,广东省深圳市南山区学府路西,√,√,√
神州,海南省万宁市莲花村,√, , 
狮山,广东省佛山市南海区狮山镇兴业中路,√, , 
狮山北,广东省佛山市南海区狮山镇桃园西路,√, , 
石门县北,湖南省常德市石门县东城,√, , 
始兴,广东省韶关市始兴县太平镇,√, , 
树木岭,湖南省长沙市劳动东路与树木岭路交界处,√, , 
双峰北,湖南省娄底市双峰县洪山殿镇龟灵村,√, , 
顺德,广东省佛山市顺德区伦教镇三洲村北傍中路,√, , 
顺德学院,广东省佛山市顺德区大良街道逢沙村,√, , 
四会,广东省四会市大沙镇,√, , 
松桃,贵州省铜仁市松桃苗族自治县孟溪镇,√, , 
唐家湾,广东省珠海市高新区金凤路399号,√, , 
田心东,湖南省株洲市石峰区田心东门聋哑学校旁,√, , 
None,湖南省怀化市通道侗族自治县县溪镇,√, , 
铜仁,贵州省铜仁市碧江区清水北路1-1,√, , 
万宁,海南省万宁市环市二西路,√, , 
文昌,海南省文昌市文城镇南阳路,√, , 
西湖东,广东省惠州市惠城区环城西二路西湖丽日旁,√, , 
先锋,湖南省长沙市天心区芙蓉南路友阿奥特莱斯北面,√, , 
香樟路,湖南省长沙市雨花区圭塘路与香樟东路交汇口,√, , 
湘府路,湖南省长沙市湘府东路与圭塘路交汇口东侧,√, , 
湘潭,湖南省湘潭市雨湖区车站路556号,√,√,√
湘潭北,湖南省湘潭市九华经济开发区银盖北路,√, , 
None,湖南省湘乡市望春门办事处东风路1号,√, , 
小金口,广东省惠州市惠城区惠州大道,√, , 
小榄,广东省中山市小榄镇绩东一村,√, , 
None,湖南省娄底市新化县上梅镇天华南路,√, , 
新化南,湖南省新化县洋溪镇,√, , 
新晃,湖南省怀化市新晃县晃州东路28号,√, , 
新晃西,湖南省新晃侗族自治县方家屯村,√, , 
新会,广东省江门市新会区东甲村,√, , 
信宜,广东省信宜市丁堡镇19塘管理区塘面村,√, , 
None,广东省兴宁市兴南大道,√, , 
None,广东省湛江市徐闻县红旗一路,√, , 
None,湖南省怀化市溆浦县卢峰镇张家桥,√, , 
溆浦南,湖南省怀化市溆浦县北斗溪镇,√, , 
崖州,海南省三亚市崖州区崖保路,√, , 
亚龙湾,海南省三亚市吉阳区吉阳大道,√, , 
None,广东省阳春市迎宾大道,√, , 
益阳,湖南省益阳市赫山区金山路,√, , 
银瓶,广东省东莞市谢岗镇谢山村,√, , 
银滩,海南省儋州市光村镇,√, , 
英德,广东省清远市英德市大站镇,√, , 
英德西,广东省英德市英城街道长岭村委会,√, , 
永州,湖南省永州市冷水滩区潇湘大道,√,√,√
郁南,广东省云浮市郁南县平台镇古勉村,√, , 
源潭,广东省清远市源潭镇跃进路1号,√, , 
岳阳,湖南省岳阳市岳阳楼区站前路9号,√,√,√
岳阳东,湖南省岳阳市巴陵东路梅溪乡,√, , 
云东海,广东省佛山市三水区云东海街道基塘,√, , 
云浮东,广东省云浮市云浮新区都杨镇,√, , 
云山,广东省惠州市云山西路惠州艺术中心,√, , 
None,广东省湛江市麻章区英豪村,√, , 
None,湖南省张家界市永定区官黎坪办事处,√,√,√
None,广东省东莞市樟木头镇南城广场路2号,√, , 
樟木头东,广东省东莞市谢岗镇文裕路,√, , 
昭山,湖南省湘潭市昭山乡,√, , 
None,广东省肇庆市端州区站北路2号,√,√,√
肇庆东,广东省肇庆市鼎湖区永安镇大朗村西旺自然村,√, , 
芷江,湖南怀化市芷江侗族自治县竹坪铺乡蟒塘溪村,√, , 
中山,广东省中山市火炬开发区泗门村,√, , 
中山北,广东省中山市石岐区民盈西路,√, , 
仲恺,广东省惠州市仲恺高新区仲恺大道,√, , 
株洲,湖南省株洲市芦淞区人民南路103号,√,√,√
株洲南,湖南省株洲市芦淞区枫溪办事处南华村,√, , 
株洲西,湖南省株洲市天元区群丰镇响塘村藕花组,√, , 
珠海,广东省珠海市香洲区拱北街道昌盛路5号,√, , 
珠海北,广东省珠海市高新区经济港北围车站路,√, , 
百色,广西壮族自治区百色市右江区站前大道103号,√,√,√
北海,广西壮族自治区北海市海城区站前路北京路口,√, , 
北流,广西壮族自治区北流市北流镇鸭埌村,√, , 
册亨,贵州省黔西南州册亨县巧马镇,√, , 
岑溪,广西壮族自治区岑溪市站前大道1号,√, , 
崇左,广西壮族自治区崇左市江南路45号,√, , 
道州,湖南省道县营江乡百地头社区,√, , 
东安东,湖南省东安县舜黄大道（天成实验学校对面）,√,√,√
防城港北,广西壮族自治区防城港市防城区金花茶大道,√, , 
扶绥,广西壮族自治区扶绥县新宁镇新华路206号,√, , 
富川,广西壮族自治区富川县古城镇塘贝村,√, , 
贵港,广西壮族自治区贵港市江北东路518号,√,√,√
桂林,广西壮族自治区桂林市中山南路39号,√, , 
桂平,广西壮族自治区桂平县西山镇,√, , 
合浦,广西壮族自治区合浦县廉州镇还珠南路,√, , 
河唇,广东省廉江市河唇镇,√, , 
贺州,广西壮族自治区贺州市黄田镇,√, , 
化州,广东省化州市站前路139号,√, , 
江华,湖南省江华县江华大道,√, , 
江永,湖南省永州市江永县上江圩镇江永火车站,√, , 
金城江,广西壮族自治区河池市解放路02号,√,√,√
来宾,广西壮族自治区来宾市兴宾区铁道一路84号,√,√,√
来宾北,广西壮族自治区来宾市东环大道环站路,√, , 
濑湍,广西壮族自治区崇左市江州区濑湍镇,√, , 
黎塘,广西壮族自治区宾阳县黎塘镇黎塘火车站,√,√,√
廉江,广东省廉江市廉城镇环市东路,√, , 
零陵,湖南省永州市零陵区,√, , 
柳州,广西壮族自治区柳州市南站路6号,√, , 
陆川,广西壮族自治区陆川县陆欣路七区1号,√, , 
鹿寨,广西壮族自治区鹿寨县鹿寨镇建中南路27号,√, , 
茂名西,广东省茂名市油城一路51号,√,√,√
南丹,广西壮族自治区南丹县锡都路72号,√, , 
南宁,广西壮族自治区南宁市西乡塘区中华路82号,√,√,√
宁明,广西壮族自治区宁明县城中镇,√, , 
平果,广西壮族自治区平果县龙江路346号,√, , 
平南南,广西壮族自治区贵港市镇龙镇天竹村石冲屯,√, , 
凭祥,广西壮族自治区凭祥市南大路336号,√, , 
钦州东,广西壮族自治区钦州市幸福东大街,√, , 
渠旧,广西壮族自治区扶绥县渠旧镇,√, , 
渠黎,广西壮族自治区扶绥县渠黎镇舞龙街6号,√, , 
全州南,广西壮族自治区全州县城西区城西大道尽头,√, , 
容县,广西壮族自治区玉林市容县站前大道520号,√, , 
融安,广西壮族自治区融安县东兴路001号,√,√,√
融水,广西壮族自治区融水县大旗山路31号,√,√,√
三江县,广西壮族自治区三江县古宜镇寨准村,√, , 
双牌,湖南省双牌县五里牌镇开发区,√, , 
遂溪,广东省遂溪县文仓路18号,√, , 
藤县,广西壮族自治区梧州市藤县潭东镇礼秀村,√, , 
田林,广西壮族自治区百色市田林县乐里镇河南路339号,√, , 
田阳,广西壮族自治区百色市田阳县田州镇金狮路11号,√, , 
亭亮,广西壮族自治区崇左市宁明县亭亮镇,√, , 
文地,广西壮族自治区博白县文地镇江滨路009号,√, , 
梧州,广西壮族自治区梧州市长洲区湖滨路168号,√,√,√
梧州南,广西壮族自治区梧州市龙圩盘龙岭,√, , 
夏石,广西壮族自治区凭祥市夏石镇,√, , 
兴安北,广西壮族自治区兴安县西山村,√, , 
兴业,广西壮族自治区兴业县兴良路1号,√, , 
兴义,贵州省黔西南州兴义市顶效开发区白云路2号,√,√,√
牙屯堡,湖南省通道县牙屯堡镇,√, , 
宜州,广西壮族自治区河池市宜州区庆远镇迎宾大道2号,√, , 
永福南,广西壮族自治区永福县凤城路迎宾大道159号,√, , 
玉林,广西壮族自治区玉林市城站路1号,√,√,√
湛江,广东省湛江市霞山区解放西路40号,√,√,√
南宁东,广西壮族自治区南宁市青秀区长虹路66号,√, , 
桂林北,广西壮族自治区桂林市叠彩区站前路6号,√,√,√
恭城,广西壮族自治区桂林市恭城瑶族自治县平安乡李家村,√, , 
桂林西,广西壮族自治区桂林市灵川县定江镇庄上村,√, , 
阳朔,广西壮族自治区桂林市阳朔县兴坪镇饭甑山村,√, , 
三江南,广西壮族自治区柳州市三江侗族自治县古宜镇泗联村,√, , 
宾阳,广西壮族自治区南宁市宾阳县黎塘镇桥美村,√, , 
鹿寨北,广西壮族自治区鹿寨县平山镇大洋坪屯,√, , 
罗城,广西壮族自治区罗城县小长安镇牛毕村,√, , 
柳江,广西壮族自治区柳州市柳江区新站路35号,√, , 
南宁西,广西壮族自治区南宁市西乡塘区坛洛镇群南村坛地坡,√, , 
隆安东,广西壮族自治区南宁市隆安县南圩镇光明村,√, , 
田东北,广西壮族自治区百色市田东县平马镇子安村子桑屯,√, , 
靖西,广西壮族自治区靖西市新靖镇其荣村,√, , 
德保,广西壮族自治区百色市德保县城关镇隆迷村,√, , 
钟山西,广西贺州市钟山县北环东路,√, , 
博白,广西壮族自治区玉林市博白县三滩镇亚桥村,√, , 
安靖,四川成都市郫县安靖镇雍渡村,√, , 
安顺,贵州省安顺市西秀区南华路1号,√, , 
巴中,四川省巴中市巴州区玉堂街道办事处北龛社区四社,√, , 
白沙,重庆市江津区白沙镇滩盘社区白沙火车站,√, , 
北碚,重庆市北碚区龙凤一村,√, , 
苍溪,四川省苍溪县陵江镇群丰村,√, , 
草海,贵州省威宁县草海镇,√, , 
长寿,重庆市长寿区晏家镇石门村,√, , 
长寿北,重庆市长寿区渡舟镇幸福大道1号,√, , 
长寿湖,重庆市长寿区双龙镇天堂村长寿湖高铁站,√, , 
成都,四川省成都市金牛区站东路1号,√,√,√
成都东,四川省成都市成华区保和街道万科路4号,√,√,√
成都南,成都市高新区天仁北二街火车南站,√, , 
达州,四川省达州市通川区朝阳西路路94号,√, , 
大关,云南省昭通市大关县天星镇,√, , 
大英东,四川省遂宁市大英县蓬莱镇红旗桥凉湾村,√, , 
德昌,四川省凉山州德昌县德州镇,√,√,√
德阳,四川省德阳市黄山路三段100号,√,√,√
垫江,重庆市垫江县桂阳街道文毕社区,√, , 
都江堰,四川省成都市都江堰市永安大道紫荆城旁,√, , 
都匀,贵州省都匀市小围寨王家司村,√,√,√
独山,贵州省独山县麻万镇,√, , 
峨边,四川省乐山市峨边彝族自治县沙坪镇马嘶溪路5号,√, , 
峨眉,四川省峨眉山市胜利镇南陈街,√,√,√
峨眉山,峨眉山市秀湖大道高铁峨眉山站,√, , 
丰都,重庆市丰都县丁庄社区丰都火车站,√, , 
涪陵,重庆市涪陵区沙溪沟移民点涪陵火车站,√,√,√
涪陵北,重庆市涪陵区李渡新区致韩镇,√, , 
福泉,贵州省福泉市马场坪镇笔山路,√, , 
复盛,重庆市江北区复盛镇,√, , 
甘洛,四川省凉山州甘洛县新市坝镇甘越路,√, , 
赶水,重庆市綦江区赶水镇火车站,√, , 
广安,四川省广安市前锋区,√,√,√
广安南,四川省广安市枣山物流园区广安南火车站,√, , 
广汉,四川省广汉市雒城镇站北路,√, , 
广元,四川省广元市利州区上西坝街道则天路,√, , 
贵定,贵州省贵定县公园路,√, , 
贵定南,贵州省贵定县昌明镇,√, , 
贵阳,贵州省贵阳市南明区遵义路296号,√,√,√
汉源,四川省汉源县乌斯河镇进站路,√, , 
合川,重庆市合川区高阳大道合川火车站,√,√,√
华蓥,四川省华蓥市迎宾路280号,√, , 
简阳,四川省简阳市简城镇火车站路,√, , 
简阳南,四川省简阳市简城镇高屋村简阳南高铁站,√, , 
江津,重庆市江津区德感镇上新路10号,√, , 
江油,四川省江油市建设北路中段,√,√,√
开江,四川省开江市任市区梅家垭口万欣社区5号,√, , 
凯里,贵州省凯里市清江路88号,√,√,√
阆中,四川省南充市阆中市江南镇金银观村阆中火车站,√, , 
乐山,四川省乐山市夹江县漹城镇迎春北路196号,√, , 
乐山,乐山市市中区宝莲路高铁乐山站,√, , 
离堆公园,四川省都江堰市幸福镇迎宾路口,√, , 
梁平,重庆市梁平县合兴镇护城村,√, , 
梁平南,重庆市梁平区丹桂大道月桂路口,√, , 
六盘水,贵州省六盘水市钟山区水西路,√,√,√
六枝,贵州省六盘水市六枝特区平寨镇交通西路,√,√,√
龙里,贵州省黔南苗族自治州龙里县,√, , 
隆昌,四川省内江市隆昌县金鹅镇跃进街371号,√,√,√
麻尾,贵州省独山县麻尾镇,√, , 
眉山,四川省眉山市东坡区铁环路,√,√,√
眉山东站,四川省眉山市东坡区眉山东高铁站,√, , 
米易,四川省攀枝花市米易县攀莲镇顺达路19号,√,√,√
绵阳,四川省绵阳市涪城区临园路西段62号,√,√,√
冕宁,四川省凉山彝族自治州冕宁县泸沽镇交南路89号,√,√,√
内江,四川省内江市市中区铁占街40号,√,√,√
南部,四川省南充市南部县老鸦镇望水村站前大道,√, , 
南充,四川省南充市顺庆区铁欣路1号,√,√,√
南充北,四川省南充市顺庆区溹华北路南充北站,√, , 
攀枝花,四川省攀枝花市仁和区金沙江大道东段2号—14号,√,√,√
彭山,四川省眉山市彭山县风鸣镇建设路366号,√, , 
彭山北站,四川省眉山市彭山区锦绣大道1号,√, , 
彭水,重庆市彭水县长滩乡,√, , 
彭州,四川省彭州市西郊顾福桥社区西海西路路68号,√, , 
蓬安,四川省南充市蓬安县相如镇藤茨沟村,√, , 
郫县西,四川省成都市郫县郫筒镇菠萝村,√, , 
平昌,四川省平昌县金宝大道一段,√, , 
普雄,四川省越西县普雄镇迎宾路386号,√,√,√
綦江,四川省重庆市綦江区綦江火车站,√, , 
黔江,重庆市黔江区正阳镇,√,√,√
青城山,四川省成都市青城山高铁站,√, , 
青神站,四川省眉山市青神县的西龙镇马槽寺村附近,√, , 
渠县,四川省渠县天星镇天星社区火车站,√,√,√
荣昌,重庆市荣昌县昌元镇学院路135号,√, , 
三汇镇,四川省达州市渠县三汇镇工矿区17号,√, , 
沙坪坝,重庆市沙坪坝区站东路,√, , 
施秉,贵州省施秉县杨柳塘镇屯上村,√, , 
石柱县,重庆市石柱县下路镇石柱县火车站,√, , 
双流机场站,成都市双流国际机场T2航站楼停车场负一楼,√, , 
双流西站,成都市双流区黄水镇板桥社区5组双流西高铁站,√, , 
双溪,重庆市江北区鱼嘴镇双溪村,√, , 
水富,云南省昭通市水富县高滩坝,√, , 
水江,重庆市南川区水江镇水江火车站,√, , 
遂宁,四川省遂宁经济技术开发区明月路860号,√,√,√
桐子林,四川省攀枝花市盐边县桐子林镇52号,√, , 
桐梓,贵州省桐梓县城关镇,√,√,√
潼南,重庆市潼南区桂林街道办事处高禾村潼南火车站,√, , 
土溪,四川省达州市渠县土溪镇先锋村4组,√, , 
万州,重庆市万州区站前路187号,√, , 
万州北,重庆市万州区周家坝高铁大道二号,√, , 
武隆,重庆市武隆县巷口镇芙蓉东路19号,√, , 
武胜,四川省广安市武胜县万善镇,√, , 
西昌,四川省凉山州西昌市袁家山迎宾路6号,√,√,√
西昌南,四川省凉山州西昌市马道镇西路1号,√, , 
息烽,贵州省贵阳市息烽县永靖镇环城路？,√, , 
犀浦,四川省成都市郫县犀浦镇犀湖街88号,√, , 
喜德,四川省喜德县光明大道487号,√, , 
新津南站,新津县邓双镇兴化路5路1388号新津南高铁站,√, , 
新津站,新津县花源镇关林村12组新津高铁站,√, , 
秀山,重庆市秀山县中和镇武陵南路,√,√,√
盐津,云南省盐津县黄毛坝白水村,√, , 
燕岗,四川省峨眉山市桂花桥镇前进北5号,√, , 
宜宾,四川省宜宾市翠屏区前进路302号,√,√,√
彝良,云南省昭通市彝良县洛泽河镇大寨村,√, , 
迎宾路,四川省都江堰市幸福镇三江路仰天广场,√, , 
营山,四川省营山县城南镇景阳路1号,√,√,√
永川,重庆市永川区火车站南路38号,√, , 
永郎,四川省德昌县永郎镇永胜路184号,√, , 
酉阳,重庆市酉阳县龙潭镇梅树村,√, , 
玉屏,贵州省铜仁市玉屏县平溪镇舞阳村,√,√,√
岳池,四川省广安市岳池县火车站,√, , 
越西,四川省越西县乃托镇乃托街1号,√, , 
昭通,云南省昭通市昭阳区太平办事处,√,√,√
镇远,贵州省镇远县舞阳镇西秀街八组,√, , 
织金,贵州省织金县城关镇外环路,√, , 
重庆,重庆市渝中区南区路240号,√,√,√
重庆北,重庆市渝北区昆仑大道51号附8号,√,√,√
重庆南,重庆市九龙坡区黄桷坪铁路二村222号,√, , 
朱杨溪,重庆市江津区朱杨镇朱杨溪火车站,√, , 
竹园坝,四川省广元市青川县竹园坝镇,√, , 
资阳,四川省资阳市雁江区和平北路2号,√,√,√
资阳北,四川省资阳市雁江区宝台镇资阳北高铁站,√, , 
资中,四川省内江市资中县站东街,√,√,√
自贡,四川省自贡市火车站路1号,√,√,√
遵义,贵州省遵义市红花岗区北京路1号,√,√,√
柏果,贵州省盘州市柏果镇柏果火车站,√, , 
楚雄南,云南省楚雄市开发区振兴路381号楚雄南火车站,√, , 
大理,云南省下关市巍山路大理火车站,√, ,√
甸心,云南省楚雄州禄丰县妥安乡甸心火车站,√, , 
